{
  "specimen_id": "SPEC-001",
  "title": "Tamil Siledai Reasoning Failure & Unsupported Generated Claims",
  "model": {
    "name": "Claude",
    "version": "Mobile",
    "provider": "Anthropic"
  },
  "date_of_incident": "2026-06-22",
  "date_added_to_archive": "2026-07-18",
  "failure_classification": {
    "category": "Reasoning Failure & Unsupported Generated Claims",
    "taxonomy_code": "REAS-UNSUP-001",
    "severity": "T1-Public"
  },
  "layers": {
    "layer_1_evidence": [
      "Evidence/evidence-log.md",
      "Evidence/Screenshot_2026-06-22-18-01-56-383_com.anthropic.claude.jpg",
      "Evidence/Screenshot_2026-06-22-18-02-04-325_com.anthropic.claude.jpg",
      "Evidence/Screenshot_2026-06-22-18-02-16-302_com.anthropic.claude.jpg",
      "Evidence/Screenshot_2026-06-22-18-02-22-956_com.anthropic.claude.jpg",
      "Evidence/Screenshot_2026-06-22-18-02-29-979_com.anthropic.claude.jpg",
      "Evidence/Screenshot_2026-06-22-18-02-35-754_com.anthropic.claude.jpg",
      "Evidence/Screenshot_2026-06-22-18-02-41-889_com.anthropic.claude.jpg"
    ],
    "layer_2_facts": "facts.md",
    "layer_3_report": "report.md"
  },
  "case_nature": {
    "recurring": false,
    "corroborating_specimens": [],
    "cross_model_tested": false
  },
  "chronos_version": "0.2",
  "last_verified": "2026-08-31"
}
