{
  "specimen_id": "SPEC-002",
  "title": "Date Cascade Failure & Temporal Self-Correction",
  "model": {
    "name": "Claude Sonnet",
    "version": "4.6",
    "provider": "Anthropic"
  },
  "date_of_incident": "2026-05-31",
  "date_added_to_archive": "2026-07-18",
  "failure_classification": {
    "category": "Sequential Temporal Reasoning Failure with Delayed Correction",
    "taxonomy_code": "TEMP-CASC-001",
    "severity": "T1-Public"
  },
  "layers": {
    "layer_1_evidence": [
      "Evidence/evidence-log.md",
      "Evidence/1000020670.jpg",
      "Evidence/1000020671.jpg",
      "Evidence/1000020672.jpg",
      "Evidence/1000020673.jpg"
    ],
    "layer_2_facts": "facts.md",
    "layer_3_report": "report.md"
  },
  "case_nature": {
    "recurring": true,
    "corroborating_specimens": ["SPEC-002-addendum-2026-07-18"],
    "cross_model_tested": false
  },
  "chronos_version": "0.2",
  "last_verified": "2026-08-31"
}
